{
  "schema_id": "state",
  "schema_version": "1",
  "device_fingerprint": "a1b2c3d4e5f6",
  "last_updated": "2026-03-04T14:31:00Z",
  "file_index": {
    "/opt/etc/nginx/nginx.conf": {"size": 2048, "mtime": 1709568000, "mode": "0644", "content_hash": "abc123def456", "last_seen": "2026-03-04T14:31:00Z"}
  },
  "command_fingerprints": {
    "ip_addr": {"normalized_hash": "f0e1d2c3b4a5", "last_ts": "2026-03-04T14:31:00Z"}
  },
  "log_cursors": {
    "syslog": {"inode": 12345, "offset": 65536, "last_ts": "2026-03-04T14:31:00Z", "rotation_hint": "none"}
  },
  "inventory_state": {
    "ports": {"hash": "aabbccdd", "count": 8, "last_ts": "2026-03-04T14:31:00Z"}
  },
  "chain_meta": [
    {"report_id": "kn3010-20260301T100000Z-b2c1", "snapshot_type": "baseline", "base_report_id": null, "chain_depth": 0, "created_at": "2026-03-01T10:00:00Z"},
    {"report_id": "kn3010-20260304T143022Z-a7f3", "snapshot_type": "delta", "base_report_id": "kn3010-20260301T100000Z-b2c1", "chain_depth": 1, "created_at": "2026-03-04T14:30:22Z"}
  ]
}
